{
  "schema": "hgtran-ai.sdd-integration.consent/v1",
  "contract": "hgtran-ai.sdd-integration/v1",
  "operation": "sdd-attempt.grant",
  "action": "consent_required",
  "blocking": true,
  "change": "multi-repo-rollout",
  "missing_roots": [
    "/workspace/service-a",
    "/workspace/service-b"
  ],
  "headline": "This change plans work outside its authorized edit roots.",
  "reason": "the task plan targets edit paths that no edit authority covers, so apply stays blocked until a human decides.",
  "value": "Granting edit authority to this change alone: the grant is recorded in the change's ledger, auditable, and dies with archive.",
  "evidence": [
    "/workspace/service-a is outside the authorized edit roots",
    "/workspace/service-b is outside the authorized edit roots"
  ],
  "choices": [
    {
      "answer": "granted",
      "label": "Grant this change edit authority over the named edit roots",
      "effect": "This change's apply actor may edit paths under the named edit roots. The grant is per-change, audited (who, when, which roots), and dies with archive; nothing is granted to any other change.",
      "invocation": "hgtran-ai sdd-attempt grant --cwd \"/workspace/planning\" --change multi-repo-rollout --root \"/workspace/service-a\" --root \"/workspace/service-b\" --actor maintainer --reason edit-authority-consent-granted --request-id grant-ce874466367354a2 --change-instance sdd-b2f4c0a1d8e64953a7c15b9d3e0f2a68"
    },
    {
      "answer": "declined",
      "label": "Keep the change blocked",
      "effect": "The change stays blocked(edit_authority_missing) and nothing is persisted. Both exits stay open: edit the change's tasks.md so no work unit targets an unauthorized edit path, or grant edit authority for the named edit roots with the named grant invocation.",
      "invocation": "hgtran-ai sdd-status multi-repo-rollout --cwd \"/workspace/planning\""
    }
  ],
  "off_path": {
    "note": "To keep this change inside its authorized edit roots instead, edit its tasks.md so no work unit targets an unauthorized edit path, then re-enter through 'hgtran-ai sdd-status multi-repo-rollout --cwd \"/workspace/planning\"'.",
    "command": "hgtran-ai sdd-status multi-repo-rollout --cwd \"/workspace/planning\""
  }
}
